DAY-9
=========

between-operator
===================

ERROR 1046 (3D000): No database selected
mysql> show databases;
+--------------------+
| Database           |
+--------------------+
| company            |
| da3                |
| information_schema |
| mysql              |
| performance_schema |
| sys                |
+--------------------+
6 rows in set (0.05 sec)

mysql> use da3;
Database changed
mysql> CREATE TABLE Orders (
    ->  id INT,
    ->  customer_name VARCHAR(100),
    ->  order_date DATE,
    ->  total_amount DECIMAL(10,2)
    ->  );
Query OK, 0 rows affected (0.06 sec)

mysql>
mysql> -- STEP 2: Insert Records
mysql> INSERT INTO Orders VALUES
    ->  (1, 'Alice', '2024-03-01', 1500.00),
    ->  (2, 'Bob', '2024-03-05', 450.00),
    ->  (3, 'Charlie', '2024-03-10', 2500.00),
    ->  (4, 'Diana', '2024-03-15', 800.00),
    ->  (5, 'Eve', '2024-03-20', 1200.00),
    ->  (6, 'Frank', '2024-03-25', 3000.00),
    ->  (7, 'Grace', '2024-04-02', 1800.00),
    ->  (8, 'Henry', '2024-04-08', 950.00),
    ->  (9, 'Ivy', '2024-04-12', 2750.00),
    ->  (10, 'Jack', '2024-04-18', 650.00),
    ->  (11, 'Kevin', '2024-04-22', 4200.00),
    ->  (12, 'Lily', '2024-05-01', 1350.00),
    ->  (13, 'Michael', '2024-05-08', 5000.00),
    ->  (14, 'Nancy', '2024-05-15', 2250.00),
    ->  (15, 'Oliver', '2024-05-25', 900.00);
Query OK, 15 rows affected (0.01 sec)
Records: 15  Duplicates: 0  Warnings: 0

mysql> select * from table orders;
ERROR 1064 (42000): You have an error in your SQL syntax; check the manual that corresponds to your MySQL server version for the right syntax to use near 'table orders' at line 1
mysql> select * from orders;
+------+---------------+------------+--------------+
| id   | customer_name | order_date | total_amount |
+------+---------------+------------+--------------+
|    1 | Alice         | 2024-03-01 |      1500.00 |
|    2 | Bob           | 2024-03-05 |       450.00 |
|    3 | Charlie       | 2024-03-10 |      2500.00 |
|    4 | Diana         | 2024-03-15 |       800.00 |
|    5 | Eve           | 2024-03-20 |      1200.00 |
|    6 | Frank         | 2024-03-25 |      3000.00 |
|    7 | Grace         | 2024-04-02 |      1800.00 |
|    8 | Henry         | 2024-04-08 |       950.00 |
|    9 | Ivy           | 2024-04-12 |      2750.00 |
|   10 | Jack          | 2024-04-18 |       650.00 |
|   11 | Kevin         | 2024-04-22 |      4200.00 |
|   12 | Lily          | 2024-05-01 |      1350.00 |
|   13 | Michael       | 2024-05-08 |      5000.00 |
|   14 | Nancy         | 2024-05-15 |      2250.00 |
|   15 | Oliver        | 2024-05-25 |       900.00 |
+------+---------------+------------+--------------+
15 rows in set (0.00 sec)

mysql> select*from Orders where order_date between '2024-03-03' AND '2024-03-10;
    '> ^C
mysql> select*from Orders where order_date between '2024-03-03' AND '2024-03-10;
    '> select*from Orders where order_date between '2024-03-03' AND '2024-03-10'^C
mysql> select*from Orders where order_date between '2024-03-03' AND '2024-03-10';
+------+---------------+------------+--------------+
| id   | customer_name | order_date | total_amount |
+------+---------------+------------+--------------+
|    2 | Bob           | 2024-03-05 |       450.00 |
|    3 | Charlie       | 2024-03-10 |      2500.00 |
+------+---------------+------------+--------------+
2 rows in set (0.00 sec)

mysql> update Orders set total_amount=total_amount+1000 where order_date between '2024-03-04' and '2024-03-10';
Query OK, 2 rows affected (0.01 sec)
Rows matched: 2  Changed: 2  Warnings: 0

mysql> delete from orders where order_date between '2024-3-10' AND'2024-03-20';
Query OK, 3 rows affected (0.01 sec)

mysql> select * from orders;
+------+---------------+------------+--------------+
| id   | customer_name | order_date | total_amount |
+------+---------------+------------+--------------+
|    1 | Alice         | 2024-03-01 |      1500.00 |
|    2 | Bob           | 2024-03-05 |      1450.00 |
|    6 | Frank         | 2024-03-25 |      3000.00 |
|    7 | Grace         | 2024-04-02 |      1800.00 |
|    8 | Henry         | 2024-04-08 |       950.00 |
|    9 | Ivy           | 2024-04-12 |      2750.00 |
|   10 | Jack          | 2024-04-18 |       650.00 |
|   11 | Kevin         | 2024-04-22 |      4200.00 |
|   12 | Lily          | 2024-05-01 |      1350.00 |
|   13 | Michael       | 2024-05-08 |      5000.00 |
|   14 | Nancy         | 2024-05-15 |      2250.00 |
|   15 | Oliver        | 2024-05-25 |       900.00 |
+------+---------------+------------+--------------+
12 rows in set (0.00 sec)

IN-Operator:
=================

mysql> CREATE TABLE Emp (
    ->  id INT,
    ->  name VARCHAR(100),
    ->  dept VARCHAR(20),
    ->  salary INT
    ->  );
Query OK, 0 rows affected (0.03 sec)

mysql>
mysql> -- STEP 2: Insert Records
mysql> INSERT INTO Emp VALUES
    ->  (1, 'Alice', 'HR', 35000),
    ->  (2, 'Bob', 'IT', 50000),
    ->  (3, 'Charlie', 'Finance', 45000),
    ->  (4, 'Diana', 'Marketing', 40000),
    ->  (5, 'Eve', 'IT', 55000),
    ->  (6, 'Frank', 'Finance', 48000),
    ->  (7, 'Grace', 'Sales', 37000),
    ->  (8, 'Henry', 'Admin', 42000),
    ->  (9, 'Ivy', 'HR', 39000),
    ->  (10, 'Jack', 'Sales', 46000),
    ->  (11, 'Kevin', 'IT', 60000),
    ->  (12, 'Lily', 'Marketing', 41000),
    ->  (13, 'Michael', 'Admin', 38000),
    ->  (14, 'Nancy', 'Finance', 52000),
    ->  (15, 'Oliver', 'HR', 43000);
Query OK, 15 rows affected (0.01 sec)
Records: 15  Duplicates: 0  Warnings: 0

mysql> select * from Emp;
+------+---------+-----------+--------+
| id   | name    | dept      | salary |
+------+---------+-----------+--------+
|    1 | Alice   | HR        |  35000 |
|    2 | Bob     | IT        |  50000 |
|    3 | Charlie | Finance   |  45000 |
|    4 | Diana   | Marketing |  40000 |
|    5 | Eve     | IT        |  55000 |
|    6 | Frank   | Finance   |  48000 |
|    7 | Grace   | Sales     |  37000 |
|    8 | Henry   | Admin     |  42000 |
|    9 | Ivy     | HR        |  39000 |
|   10 | Jack    | Sales     |  46000 |
|   11 | Kevin   | IT        |  60000 |
|   12 | Lily    | Marketing |  41000 |
|   13 | Michael | Admin     |  38000 |
|   14 | Nancy   | Finance   |  52000 |
|   15 | Oliver  | HR        |  43000 |
+------+---------+-----------+--------+
15 rows in set (0.00 sec)

mysql> select*from emp where dept in('hr','finance');
+------+---------+---------+--------+
| id   | name    | dept    | salary |
+------+---------+---------+--------+
|    1 | Alice   | HR      |  35000 |
|    3 | Charlie | Finance |  45000 |
|    6 | Frank   | Finance |  48000 |
|    9 | Ivy     | HR      |  39000 |
|   14 | Nancy   | Finance |  52000 |
|   15 | Oliver  | HR      |  43000 |
+------+---------+---------+--------+
6 rows in set (0.00 sec)

mysql> --increase salary 2000 for employee in hr or marketing
    -> --remove employee the finance or marketing department
    -> UPDATE Emp
    -> SET salary = salary + 2000
    -> WHERE dept IN ('HR', 'Marketing');
ERROR 1064 (42000): You have an error in your SQL syntax; check the manual that corresponds to your MySQL server version for the right syntax to use near '--increase salary 2000 for employee in hr or marketing
--remove employee the fin' at line 1
mysql> update emp set salary = salary + 2000 where dept in ('hr','marketing');
Query OK, 5 rows affected (0.01 sec)
Rows matched: 5  Changed: 5  Warnings: 0

mysql> select * from emp;
+------+---------+-----------+--------+
| id   | name    | dept      | salary |
+------+---------+-----------+--------+
|    1 | Alice   | HR        |  37000 |
|    2 | Bob     | IT        |  50000 |
|    3 | Charlie | Finance   |  45000 |
|    4 | Diana   | Marketing |  42000 |
|    5 | Eve     | IT        |  55000 |
|    6 | Frank   | Finance   |  48000 |
|    7 | Grace   | Sales     |  37000 |
|    8 | Henry   | Admin     |  42000 |
|    9 | Ivy     | HR        |  41000 |
|   10 | Jack    | Sales     |  46000 |
|   11 | Kevin   | IT        |  60000 |
|   12 | Lily    | Marketing |  43000 |
|   13 | Michael | Admin     |  38000 |
|   14 | Nancy   | Finance   |  52000 |
|   15 | Oliver  | HR        |  45000 |
+------+---------+-----------+--------+
15 rows in set (0.00 sec)

mysql> delete from emp where dept in('marketing','finance');
Query OK, 5 rows affected (0.01 sec)

mysql> select * from emp;
+------+---------+-------+--------+
| id   | name    | dept  | salary |
+------+---------+-------+--------+
|    1 | Alice   | HR    |  37000 |
|    2 | Bob     | IT    |  50000 |
|    5 | Eve     | IT    |  55000 |
|    7 | Grace   | Sales |  37000 |
|    8 | Henry   | Admin |  42000 |
|    9 | Ivy     | HR    |  41000 |
|   10 | Jack    | Sales |  46000 |
|   11 | Kevin   | IT    |  60000 |
|   13 | Michael | Admin |  38000 |
|   15 | Oliver  | HR    |  45000 |
+------+---------+-------+--------+
10 rows in set (0.00 sec)

mysql> drop table emp;
Query OK, 0 rows affected (0.03 sec)


Like Operator:
===============


mysql> CREATE TABLE Emp (
    ->  id INT,
    ->  name VARCHAR(100),
    ->  dept VARCHAR(20),
    ->  salary INT
    ->  );
Query OK, 0 rows affected (0.02 sec)

mysql>
mysql> -- STEP 2: Insert Records
mysql> INSERT INTO Emp VALUES
    ->  (1, 'Rahul', 'IT', 50000),
    ->  (2, 'Ramesh', 'HR', 35000),
    ->  (3, 'Karan', 'Finance', 45000),
    ->  (4, 'Mahesh', 'Marketing', 40000),
    ->  (5, 'Suresh', 'IT', 55000),
    ->  (6, 'Arjun', 'Sales', 38000),
    ->  (7, 'Manish', 'Admin', 42000),
    ->  (8, 'Ganesh', 'Finance', 47000),
    ->  (9, 'Naresh', 'HR', 39000),
    ->  (10, 'Rohan', 'IT', 52000),
    ->  (11, 'Mohan', 'Sales', 41000),
    ->  (12, 'Kishan', 'Marketing', 43000),
    ->  (13, 'Dinesh', 'Admin', 46000),
    ->  (14, 'Rajesh', 'Finance', 51000),
    ->  (15, 'Kiran', 'IT', 48000);
Query OK, 15 rows affected (0.00 sec)
Records: 15  Duplicates: 0  Warnings: 0

mysql>
mysql> select*from emp;
+------+--------+-----------+--------+
| id   | name   | dept      | salary |
+------+--------+-----------+--------+
|    1 | Rahul  | IT        |  50000 |
|    2 | Ramesh | HR        |  35000 |
|    3 | Karan  | Finance   |  45000 |
|    4 | Mahesh | Marketing |  40000 |
|    5 | Suresh | IT        |  55000 |
|    6 | Arjun  | Sales     |  38000 |
|    7 | Manish | Admin     |  42000 |
|    8 | Ganesh | Finance   |  47000 |
|    9 | Naresh | HR        |  39000 |
|   10 | Rohan  | IT        |  52000 |
|   11 | Mohan  | Sales     |  41000 |
|   12 | Kishan | Marketing |  43000 |
|   13 | Dinesh | Admin     |  46000 |
|   14 | Rajesh | Finance   |  51000 |
|   15 | Kiran  | IT        |  48000 |
+------+--------+-----------+--------+
15 rows in set (0.00 sec)

mysql> select * from emp where name like 'r%';
+------+--------+---------+--------+
| id   | name   | dept    | salary |
+------+--------+---------+--------+
|    1 | Rahul  | IT      |  50000 |
|    2 | Ramesh | HR      |  35000 |
|   10 | Rohan  | IT      |  52000 |
|   14 | Rajesh | Finance |  51000 |
+------+--------+---------+--------+
4 rows in set (0.00 sec)

mysql> select * from emp where name like '%sh';
+------+--------+-----------+--------+
| id   | name   | dept      | salary |
+------+--------+-----------+--------+
|    2 | Ramesh | HR        |  35000 |
|    4 | Mahesh | Marketing |  40000 |
|    5 | Suresh | IT        |  55000 |
|    7 | Manish | Admin     |  42000 |
|    8 | Ganesh | Finance   |  47000 |
|    9 | Naresh | HR        |  39000 |
|   13 | Dinesh | Admin     |  46000 |
|   14 | Rajesh | Finance   |  51000 |
+------+--------+-----------+--------+
8 rows in set (0.00 sec)

mysql> select * from emp where name like '%ar%'
    -> ^C
mysql> select * from emp where name like '%ar%';
+------+--------+---------+--------+
| id   | name   | dept    | salary |
+------+--------+---------+--------+
|    3 | Karan  | Finance |  45000 |
|    6 | Arjun  | Sales   |  38000 |
|    9 | Naresh | HR      |  39000 |
+------+--------+---------+--------+
3 rows in set (0.00 sec)

mysql> select * from emp where name like '_____';
+------+-------+---------+--------+
| id   | name  | dept    | salary |
+------+-------+---------+--------+
|    1 | Rahul | IT      |  50000 |
|    3 | Karan | Finance |  45000 |
|    6 | Arjun | Sales   |  38000 |
|   10 | Rohan | IT      |  52000 |
|   11 | Mohan | Sales   |  41000 |
|   15 | Kiran | IT      |  48000 |
+------+-------+---------+--------+
6 rows in set (0.00 sec)

mysql> select * from emp where name like 'k___n';
+------+-------+---------+--------+
| id   | name  | dept    | salary |
+------+-------+---------+--------+
|    3 | Karan | Finance |  45000 |
|   15 | Kiran | IT      |  48000 |
+------+-------+---------+--------+
2 rows in set (0.00 sec)

mysql> select * from emp where name like 'k%n';
+------+--------+-----------+--------+
| id   | name   | dept      | salary |
+------+--------+-----------+--------+
|    3 | Karan  | Finance   |  45000 |
|   12 | Kishan | Marketing |  43000 |
|   15 | Kiran  | IT        |  48000 |
+------+--------+-----------+--------+
3 rows in set (0.00 sec)

mysql> select * from emp where name like '_a%';
+------+--------+-----------+--------+
| id   | name   | dept      | salary |
+------+--------+-----------+--------+
|    1 | Rahul  | IT        |  50000 |
|    2 | Ramesh | HR        |  35000 |
|    3 | Karan  | Finance   |  45000 |
|    4 | Mahesh | Marketing |  40000 |
|    7 | Manish | Admin     |  42000 |
|    8 | Ganesh | Finance   |  47000 |
|    9 | Naresh | HR        |  39000 |
|   14 | Rajesh | Finance   |  51000 |
+------+--------+-----------+--------+
8 rows in set (0.00 sec)

mysql> select * from emp where name like '%n';
+------+--------+-----------+--------+
| id   | name   | dept      | salary |
+------+--------+-----------+--------+
|    3 | Karan  | Finance   |  45000 |
|    6 | Arjun  | Sales     |  38000 |
|   10 | Rohan  | IT        |  52000 |
|   11 | Mohan  | Sales     |  41000 |
|   12 | Kishan | Marketing |  43000 |
|   15 | Kiran  | IT        |  48000 |
+------+--------+-----------+--------+
6 rows in set (0.00 sec)

mysql> select * from emp where name like 'm%e%';
+------+--------+-----------+--------+
| id   | name   | dept      | salary |
+------+--------+-----------+--------+
|    4 | Mahesh | Marketing |  40000 |
+------+--------+-----------+--------+
1 row in set (0.00 sec)

mysql> select * from emp where name like '_____h';
+------+--------+-----------+--------+
| id   | name   | dept      | salary |
+------+--------+-----------+--------+
|    2 | Ramesh | HR        |  35000 |
|    4 | Mahesh | Marketing |  40000 |
|    5 | Suresh | IT        |  55000 |
|    7 | Manish | Admin     |  42000 |
|    8 | Ganesh | Finance   |  47000 |
|    9 | Naresh | HR        |  39000 |
|   13 | Dinesh | Admin     |  46000 |
|   14 | Rajesh | Finance   |  51000 |
+------+--------+-----------+--------+
8 rows in set (0.00 sec)

mysql> update emp set salary=salary+2000 where name like 'r%';
Query OK, 4 rows affected (0.01 sec)
Rows matched: 4  Changed: 4  Warnings: 0

mysql> show * from emp;
ERROR 1064 (42000): You have an error in your SQL syntax; check the manual that corresponds to your MySQL server version for the right syntax to use near '* from emp' at line 1
mysql> select * from emp;
+------+--------+-----------+--------+
| id   | name   | dept      | salary |
+------+--------+-----------+--------+
|    1 | Rahul  | IT        |  52000 |
|    2 | Ramesh | HR        |  37000 |
|    3 | Karan  | Finance   |  45000 |
|    4 | Mahesh | Marketing |  40000 |
|    5 | Suresh | IT        |  55000 |
|    6 | Arjun  | Sales     |  38000 |
|    7 | Manish | Admin     |  42000 |
|    8 | Ganesh | Finance   |  47000 |
|    9 | Naresh | HR        |  39000 |
|   10 | Rohan  | IT        |  54000 |
|   11 | Mohan  | Sales     |  41000 |
|   12 | Kishan | Marketing |  43000 |
|   13 | Dinesh | Admin     |  46000 |
|   14 | Rajesh | Finance   |  53000 |
|   15 | Kiran  | IT        |  48000 |
+------+--------+-----------+--------+
15 rows in set (0.00 sec)

mysql> update emp set salary = salary +3000 where name like '%sh";
    '> update emp set salary = salary +3000 where name like '%sh';
    '> update emp set salary = salary +3000 where name like '%sh";^C
mysql> update emp set salary=salary+3000 where name like '%sh';
Query OK, 8 rows affected (0.01 sec)
Rows matched: 8  Changed: 8  Warnings: 0

mysql> update emp set salary=salary+1000 where name like '%ar%';
Query OK, 3 rows affected (0.01 sec)
Rows matched: 3  Changed: 3  Warnings: 0

mysql> update emp set salary=salary+500 where name like '_____';
Query OK, 6 rows affected (0.01 sec)
Rows matched: 6  Changed: 6  Warnings: 0

mysql> update emp set salary=salary+1500 where name like '_a%';
Query OK, 8 rows affected (0.01 sec)
Rows matched: 8  Changed: 8  Warnings: 0

mysql> select * from emp;
+------+--------+-----------+--------+
| id   | name   | dept      | salary |
+------+--------+-----------+--------+
|    1 | Rahul  | IT        |  54000 |
|    2 | Ramesh | HR        |  41500 |
|    3 | Karan  | Finance   |  48000 |
|    4 | Mahesh | Marketing |  44500 |
|    5 | Suresh | IT        |  58000 |
|    6 | Arjun  | Sales     |  39500 |
|    7 | Manish | Admin     |  46500 |
|    8 | Ganesh | Finance   |  51500 |
|    9 | Naresh | HR        |  44500 |
|   10 | Rohan  | IT        |  54500 |
|   11 | Mohan  | Sales     |  41500 |
|   12 | Kishan | Marketing |  43000 |
|   13 | Dinesh | Admin     |  49000 |
|   14 | Rajesh | Finance   |  57500 |
|   15 | Kiran  | IT        |  48500 |
+------+--------+-----------+--------+
15 rows in set (0.00 sec)

mysql> delete emp where name like 'r%';
ERROR 1064 (42000): You have an error in your SQL syntax; check the manual that corresponds to your MySQL server version for the right syntax to use near 'where name like 'r%'' at line 1
mysql> delete from emp where name like 'r%';
Query OK, 4 rows affected (0.01 sec)

mysql> delete from emp where name like '%sh';
Query OK, 6 rows affected (0.00 sec)

mysql> delete from emp where name like '_____';
Query OK, 4 rows affected (0.01 sec)

mysql> select * from emp;
+------+--------+-----------+--------+
| id   | name   | dept      | salary |
+------+--------+-----------+--------+
|   12 | Kishan | Marketing |  43000 |
+------+--------+-----------+--------+
1 row in set (0.00 sec)

mysql> delete from emp where name like 'k%n';
Query OK, 1 row affected (0.01 sec)

mysql> delete from emp where name like '_a%';
Query OK, 0 rows affected (0.00 sec)

mysql> select * from emp;
Empty set (0.00 sec)

Aggregate Functions:
=========================
aggregate functions perform calculations on multiple rows and return a single column

there are various aggregate functions. such as

function                      purpose

count()                    counts the number of rows
sum()                      calculates the total
avg()                      calculates the average value
max()                      returns the highest value
min()                      returns the lowest value

mysql> select*from emp;
+------+--------+-----------+--------+
| id   | name   | dept      | salary |
+------+--------+-----------+--------+
|    1 | Rahul  | IT        |  50000 |
|    2 | Ramesh | HR        |  35000 |
|    3 | Karan  | Finance   |  45000 |
|    4 | Mahesh | Marketing |  40000 |
|    5 | Suresh | IT        |  55000 |
|    6 | Arjun  | Sales     |  38000 |
|    7 | Manish | Admin     |  42000 |
|    8 | Ganesh | Finance   |  47000 |
|    9 | Naresh | HR        |  39000 |
|   10 | Rohan  | IT        |  52000 |
|   11 | Mohan  | Sales     |  41000 |
|   12 | Kishan | Marketing |  43000 |
|   13 | Dinesh | Admin     |  46000 |
|   14 | Rajesh | Finance   |  51000 |
|   15 | Kiran  | IT        |  48000 |
+------+--------+-----------+--------+
15 rows in set (0.00 sec)

mysql> select min(salary) as minimum_salary from emp;
+----------------+
| minimum_salary |
+----------------+
|          35000 |
+----------------+
1 row in set (0.01 sec)

mysql> select max(salary) as maximum_salary from emp;
+----------------+
| maximum_salary |
+----------------+
|          55000 |
+----------------+
1 row in set (0.00 sec)

mysql> select sum(salary) as total_salary from emp;
+--------------+
| total_salary |
+--------------+
|       672000 |
+--------------+
1 row in set (0.00 sec)

mysql> select count(*) as employee_count from emp;
+----------------+
| employee_count |
+----------------+
|             15 |
+----------------+
1 row in set (0.01 sec)

mysql> select avg(salary) as avg_salary from emp;
+------------+
| avg_salary |
+------------+
| 44800.0000 |
+------------+
1 row in set (0.00 sec)

SYSTEM INFORMATION FUNCTIONS
=============================
1.curdate()-        return the current date
2.curtime()-        reruns the current time
3.now()-            returns the both current time and date
4.database()-       return the current database name
5.user()-           return the current logged in user
6.current_user()-   returns the authenticated MYSQL account
7.version()-        return the current version of MySQL
8.sysdate()-        return the current system date and time
9.connection_id()-  returns the current connection id
10.utc_date()-      return the current utc date
11.utc_time()-      returns the current utc time
12.utc_timestamp()- return the current utc date and time.mysql> select curdate;
ERROR 1054 (42S22): Unknown column 'curdate' in 'field list'
mysql> select curdate();
+------------+
| curdate()  |
+------------+
| 2026-07-02 |
+------------+
1 row in set (0.00 sec)

mysql> select curtime();
+-----------+
| curtime() |
+-----------+
| 10:38:45  |
+-----------+
1 row in set (0.00 sec)

mysql> select now();
+---------------------+
| now()               |
+---------------------+
| 2026-07-02 10:38:54 |
+---------------------+
1 row in set (0.00 sec)

mysql> select database();
+------------+
| database() |
+------------+
| da3        |
+------------+
1 row in set (0.00 sec)

mysql> select user();
+----------------+
| user()         |
+----------------+
| root@localhost |
+----------------+
1 row in set (0.00 sec)

mysql> select version();
+-----------+
| version() |
+-----------+
| 8.0.17    |
+-----------+
1 row in set (0.00 sec)

mysql> select sys_date();
ERROR 1305 (42000): FUNCTION da3.sys_date does not exist
mysql> select sysdate();
+---------------------+
| sysdate()           |
+---------------------+
| 2026-07-02 10:40:42 |
+---------------------+
1 row in set (0.00 sec)

mysql> select systime();
ERROR 1305 (42000): FUNCTION da3.systime does not exist
mysql> select connnection_id();
ERROR 1305 (42000): FUNCTION da3.connnection_id does not exist
mysql> select connection_id();
+-----------------+
| connection_id() |
+-----------------+
|              15 |
+-----------------+
1 row in set (0.01 sec)

mysql> select current_user();
+----------------+
| current_user() |
+----------------+
| root@localhost |
+----------------+
1 row in set (0.00 sec)

mysql> select utc_date();
+------------+
| utc_date() |
+------------+
| 2026-07-02 |
+------------+
1 row in set (0.00 sec)

mysql> select utc_time();
+------------+
| utc_time() |
+------------+
| 05:12:02   |
+------------+
1 row in set (0.00 sec)

mysql> select utc_timestamp();
+---------------------+
| utc_timestamp()     |
+---------------------+
| 2026-07-02 05:12:47 |
+---------------------+
1 row in set (0.00 sec)

mysql> exit;
